<?xml version="1.0" encoding="UTF-8"?>
<drawing xmlns="http://www.archimedes.org.br/xml/FileXMLSchema"
	xmlns:xsi="http://www.w3.org/2001/XMLSchema-instance"
	xsi:schemaLocation="http://www.archimedes.org.br/xml/FileXMLSchema FileXMLSchema.xsd ">
	<zoom>0.168</zoom>
	<viewport>
		<point x="1694.344" y="-683.745" />
	</viewport>
	<container name="MeuPrimeiroLayer" lineStyle="1" thickness="1.05">
		<color>
			<unsignedByte>247</unsignedByte>
			<unsignedByte>173</unsignedByte>
			<unsignedByte>40</unsignedByte>
		</color>
		<color>
			<unsignedByte>247</unsignedByte>
			<unsignedByte>173</unsignedByte>
			<unsignedByte>40</unsignedByte>
		</color>
		<circle>
			<point x="-191" y="155" />
			<radius>93.193</radius>
		</circle>
		<line>
			<point x="-64" y="198" />
			<point x="-173" y="88" />
		</line>
		<infiniteline>
			<point x="-328" y="8" />
			<point x="-315" y="-8" />
		</infiniteline>
	</container>
	<container name="UmSegundoLayer" lineStyle="1" thickness="2">
		<color>
			<unsignedByte>102</unsignedByte>
			<unsignedByte>198</unsignedByte>
			<unsignedByte>193</unsignedByte>
		</color>
		<color>
			<unsignedByte>102</unsignedByte>
			<unsignedByte>198</unsignedByte>
			<unsignedByte>193</unsignedByte>
		</color>
		<arc>
			<point x="-278" y="43" />
			<point x="3" y="199" />
			<point x="-72" y="236" />
		</arc>
	</container>
	<container name="LayerDoAnderson" lineStyle="0" thickness="2.4">
		<color>
			<unsignedByte>207</unsignedByte>
			<unsignedByte>42</unsignedByte>
			<unsignedByte>148</unsignedByte>
		</color>
		<color>
			<unsignedByte>255</unsignedByte>
			<unsignedByte>0</unsignedByte>
			<unsignedByte>233</unsignedByte>
		</color>
		<polyline>
			<point x="-174" y="210" />
			<point x="-50" y="159" />
			<point x="-174" y="64" />
			<point x="4" y="62" />
			<point x="-170" y="8" />
		</polyline>
	</container>
	<container name="Layer 3" lineStyle="1" thickness="1">
		<color>
			<unsignedByte>255</unsignedByte>
			<unsignedByte>255</unsignedByte>
			<unsignedByte>255</unsignedByte>
		</color>
		<color>
			<unsignedByte>0</unsignedByte>
			<unsignedByte>0</unsignedByte>
			<unsignedByte>0</unsignedByte>
		</color>
		<arc>
			<point x="143" y="146" />
			<point x="41" y="-135" />
			<point x="268" y="-44" />
		</arc>
		<line>
			<point x="164" y="8" />
			<point x="-83" y="127" />
		</line>
	</container>
	<container name="LayerdoFabricio" lineStyle="0" thickness="1">
		<color>
			<unsignedByte>235</unsignedByte>
			<unsignedByte>24</unsignedByte>
			<unsignedByte>24</unsignedByte>
		</color>
		<color>
			<unsignedByte>0</unsignedByte>
			<unsignedByte>0</unsignedByte>
			<unsignedByte>0</unsignedByte>
		</color>
		<text>
			<point x="143.403" y="209.828" />
			<size>63.828</size>
			<content>Archimedes</content>
			<vector>
				<point x="1" y="0" />
			</vector>
		</text>
		<infiniteline>
			<point x="268" y="-44" />
			<point x="267.002" y="-44.063" />
		</infiniteline>
		<line>
			<point x="-1083.033" y="453.48" />
			<point x="957.756" y="-355.968" />
		</line>
	</container>
</drawing>
